{
  "schema": "item.metrics/v1",
  "message_id": "01M487VMV09SQWEG9Q6D3WXQEC",
  "produced_at": "2026-10-06T09:14:04Z",
  "producer": {
    "service": "normalize-item",
    "version": "1.4.0",
    "job_id": "01J9N2Q7Z4T8X1V6M3K0H5R2WB"
  },
  "item_id": "bda54111-94d6-54e2-aab6-33e8b5cb48c6",
  "idempotency_key": "facebook:post:100064583471102_1198837625012734",
  "platform": "facebook",
  "platform_id": "100064583471102_1198837625012734",
  "source_id": "6f1c2e3a-8b4d-4c7e-9a21-0d5e7f3b9c11",
  "created_at": "2026-10-06T07:12:09Z",
  "observation": {
    "label": "first_sight",
    "step": null,
    "observed_at": "2026-10-06T09:13:58Z"
  },
  "metrics": {
    "views": null,
    "likes": 2421,
    "comments": 403,
    "shares": 58,
    "reactions_by_type": {
      "like": 2210,
      "love": 131,
      "haha": 19,
      "wow": 4,
      "sad": 1,
      "angry": 44,
      "care": 12
    }
  },
  "provenance": {
    "route": "green",
    "vendor": null,
    "service": "fb-page-feed-poller",
    "fetched_at": "2026-10-06T09:13:58Z"
  },
  "retention_class": "meta_on_request"
}
